{
  "id": "delirium_tremens",
  "name": "Delirium Tremens (Alcohol Withdrawal)",
  "class": "non_infective",
  "system": "Neurology / Toxicology",
  "coding": {
    "icd10": "F10.231",
    "icd11": null,
    "snomed": null
  },
  "matching": {
    "find": {
      "alcoholExcess": 32,
      "behavioralChange": 18,
      "tachycardia": 8,
      "rigidity": 10,
      "ataxia": 10,
      "seizure": 10,
      "neckStiffness": -14
    },
    "associatedFindings": [
      "alcoholExcess",
      "behavioralChange",
      "rigidity",
      "ataxia",
      "seizure",
      "tachycardia"
    ],
    "reasoningTemplate": "Agitation, autonomic hyperactivity, tremor and altered sensorium 48-96 h after the last drink in a heavy drinker suggest delirium tremens — but CNS infection and Wernicke's must be excluded in parallel in any febrile or altered patient."
  },
  "redFlags": [
    "Do NOT anchor on withdrawal in a febrile/altered patient — exclude meningitis/encephalitis (LP) and give thiamine before glucose (Wernicke)",
    "Autonomic storm — hyperthermia, arrhythmia; DT carries appreciable mortality if untreated",
    "Withdrawal seizures may herald DT"
  ],
  "investigations": [
    {
      "test": "Bedside glucose + IV thiamine before glucose (Wernicke prophylaxis)"
    },
    {
      "test": "Exclude CNS infection / structural cause (LP, imaging) when febrile, focal or atypical"
    },
    {
      "test": "Electrolytes incl. Mg/PO4, LFTs; assess CIWA-Ar"
    }
  ],
  "treatmentRef": null,
  "policyRef": null,
  "calculatorRefs": [],
  "icuModuleRefs": [],
  "drugRefs": [],
  "provenance": {
    "primaryRef": "Harrison 22e",
    "editions": [
      "Harrison 22e (2025)"
    ]
  },
  "review": {
    "status": "approved",
    "reviewedBy": "Dr. Manoj Kurmana",
    "reviewedAt": "2026-07-03"
  },
  "version": 1,
  "contentHash": null,
  "references": [
    "Harrison 22e — Alcohol and Alcohol Use Disorders"
  ],
  "provenanceNote": "Recall Tier-4 new diagnosable entity (alcohol withdrawal). AI-drafted matching signature; PENDING clinician sign-off. Intentionally does NOT dominate CNS-infection candidates in a febrile/altered patient — designed to enter the top-3 as a co-consideration.",
  "algorithms": [
    {
      "id": "delirium_tremens-dx-algo",
      "title": "Delirium Tremens (Alcohol Withdrawal): Diagnostic & Clinical Decision Pathway",
      "steps": [
        {
          "step": "Clinical Presentation & Triage",
          "action": "Evaluate acute presentation and core clinical features of Delirium Tremens (Alcohol Withdrawal).",
          "critical": true
        },
        {
          "step": "Red Flag & Instability Screen",
          "branch": "Emergency Warning",
          "action": "Screen for high-risk signs: Do NOT anchor on withdrawal in a febrile/altered patient - exclude meningitis/encephalitis (LP) and give thiamine before glucose (Wernicke)",
          "critical": true
        },
        {
          "step": "Diagnostic & Biomarker Workup",
          "action": "Targeted workup: Bedside glucose + IV thiamine before glucose (Wernicke prophylaxis), Exclude CNS infection / structural cause (LP, imaging) when febrile, focal or atypical, Electrolytes incl. Mg/PO4, LFTs; assess CIWA-Ar"
        },
        {
          "step": "Severity Staging & Differentiation",
          "branch": "Classification",
          "action": "Apply evidence-based criteria to classify disease severity and organ dysfunction."
        },
        {
          "step": "Targeted Management & Monitoring",
          "action": "Initiate guideline-directed medical therapy and monitor clinical progress."
        }
      ],
      "caption": "Clinical decision and evaluation pathway for delirium tremens (alcohol withdrawal)."
    }
  ],
  "tables": [
    {
      "id": "delirium_tremens-matrix",
      "title": "Delirium Tremens (Alcohol Withdrawal): Clinical Features & Differential Matrix",
      "headers": [
        "Clinical Dimension",
        "Finding / Recommendation",
        "Significance"
      ],
      "rows": [
        [
          "Diagnostic Hallmark",
          "Cardinal presentation of Delirium Tremens (Alcohol Withdrawal)",
          "Primary clinical presentation"
        ],
        [
          "Key Investigations",
          "Bedside glucose + IV thiamine before glucose (Wernicke prophylaxis), Exclude CNS infection / structural cause (LP, imaging) when",
          "Confirmatory diagnostic testing"
        ],
        [
          "Key Differentials",
          "Alternative etiologies in this class",
          "Primary clinical mimics to rule out"
        ],
        [
          "Red Flag Alert",
          "Do NOT anchor on withdrawal in a febrile/altered patient - exclude meningitis/encephalitis (LP) and give thiamine before glucose",
          "Requires urgent stabilization"
        ],
        [
          "Clinical Pitfall",
          "Delayed recognition of atypical presentations",
          "Avoid diagnostic or therapeutic delay"
        ]
      ],
      "caption": "Diagnostic and clinical overview matrix for delirium tremens (alcohol withdrawal)."
    }
  ],
  "diagrams": [],
  "citations": [
    {
      "id": "c1",
      "label": "Entry text (StewardMD KB, alcohol withdrawal)",
      "kind": "entry"
    },
    {
      "id": "c2",
      "label": "Merck Manual Professional, Alcohol Toxicity and Withdrawal",
      "url": "https://www.merckmanuals.com/professional/special-subjects/recreational-drugs-and-intoxicants/alcohol-toxicity-and-withdrawal",
      "kind": "web"
    }
  ],
  "valueTables": [
    {
      "id": "delirium_tremens-diagnostic",
      "kind": "diagnostic",
      "title": "Timeline and severity of alcohol withdrawal",
      "rowHeader": "Criterion",
      "columns": [
        "Timing or threshold",
        "Interpretation"
      ],
      "rows": [
        {
          "parameter": "Mild withdrawal",
          "unit": "h",
          "cells": [
            {
              "text": "Within about 6 h of last drink",
              "op": "<=",
              "value": 6
            },
            {
              "text": "Tremor, anxiety"
            }
          ],
          "cite": "c2"
        },
        {
          "parameter": "Alcoholic hallucinosis",
          "unit": "h",
          "cells": [
            {
              "text": "12 to 24 h",
              "range": [
                12,
                24
              ]
            },
            {
              "text": "Clear consciousness; usually transient"
            }
          ],
          "cite": "c2"
        },
        {
          "parameter": "Withdrawal seizures",
          "unit": "h",
          "cells": [
            {
              "text": "6 to 48 h",
              "range": [
                6,
                48
              ]
            },
            {
              "text": "May herald DT"
            }
          ],
          "cite": "c2"
        },
        {
          "parameter": "Delirium tremens",
          "unit": "h",
          "cells": [
            {
              "text": "48 to 72 h",
              "range": [
                48,
                72
              ]
            },
            {
              "text": "{{hy:Delirium with autonomic instability}}"
            }
          ],
          "cite": "c2"
        },
        {
          "parameter": "Mild DT",
          "unit": "/min",
          "cells": [
            {
              "text": "Pulse 100 to 120, temp 37.2 to 37.8 C",
              "range": [
                100,
                120
              ]
            },
            {
              "text": "Lower-risk delirium"
            }
          ],
          "cite": "c2"
        },
        {
          "parameter": "Marked DT",
          "unit": "/min",
          "cells": [
            {
              "text": "Pulse >120, temp >37.8 C",
              "op": ">",
              "value": 120
            },
            {
              "text": "High risk of death"
            }
          ],
          "cite": "c2"
        },
        {
          "parameter": "Bedside glucose",
          "cells": [
            {
              "text": "Check at once"
            },
            {
              "text": "Hypoglycaemia mimics and coexists"
            }
          ],
          "cite": "c1"
        },
        {
          "parameter": "Electrolytes, magnesium, phosphate, LFTs",
          "cells": [
            {
              "text": "Baseline in all"
            },
            {
              "text": "Replace deficits"
            }
          ],
          "cite": "c1"
        },
        {
          "parameter": "CIWA-Ar",
          "cells": [
            {
              "text": "Serial scoring"
            },
            {
              "text": "Tracks severity and guides dosing"
            }
          ],
          "cite": "c1"
        }
      ],
      "footnote": "CIWA-Ar score thresholds are not given in the sources opened."
    },
    {
      "id": "delirium_tremens-ddx",
      "kind": "ddx",
      "title": "Conditions that mimic delirium tremens",
      "rowHeader": "Condition",
      "columns": [
        "Key distinguishing feature",
        "Best test to separate"
      ],
      "rows": [
        {
          "parameter": "Meningitis or encephalitis",
          "cells": [
            {
              "text": "{{hy:Fever with altered mental state; do not anchor on withdrawal}}"
            },
            {
              "text": "Lumbar puncture"
            }
          ],
          "cite": "c1"
        },
        {
          "parameter": "Head injury or intracranial bleed",
          "cells": [
            {
              "text": "Trauma, focal signs"
            },
            {
              "text": "CT head"
            }
          ],
          "cite": "c2"
        },
        {
          "parameter": "Wernicke encephalopathy",
          "cells": [
            {
              "text": "Ophthalmoplegia, ataxia, confusion"
            },